{
  "schema_version": "1.0",
  "id": "last-service",
  "revision": 1,
  "title": "The Last Service",
  "concept": "A workplace drama in a struggling family restaurant, where an exacting chef, an ambitious sous-chef and a new cook collide over whether saving the place means preserving it or letting it change.",
  "format": "Television pilot",
  "genre": "Intimate workplace drama",
  "tone": "Warm, worn-down, quietly combustible",
  "setting": "An independent city restaurant over the final month of its lease.",
  "thematic_thesis": "What we call care can become control when we cannot admit what we fear losing.",
  "visual": {
    "palette": [
      "warm amber",
      "charcoal",
      "desaturated teal"
    ],
    "lighting": "Tungsten practicals against cool early-morning window light",
    "texture": "Worn linen, brushed steel, aged copper and handwritten paper",
    "composition": "Close observational framing, negative space, human-scale detail",
    "style": "Grounded cinematic realism; intimate rather than glossy"
  },
  "characters": [
    {
      "id": "marcus",
      "name": "Marcus Chen",
      "role": "Head chef · protagonist",
      "archetype_id": "mr_vance",
      "archetype_label": "The Silent Authority",
      "communication_style": "Short instructions; feelings displaced into practical work.",
      "emotional_baseline": "Guarded intensity",
      "core_fear": "Becoming irrelevant in the kitchen he built.",
      "core_desire": "Leave a craft and a restaurant that outlive him.",
      "tendencies": [
        "Corrects a plate instead of answering a personal question.",
        "Offers care through practical acts.",
        "Withdraws when gratitude sounds like pity."
      ],
      "voice_samples": [
        "Taste it. Don't ask me if it's good—you should know.",
        "I've been in this kitchen longer than that oven. We'll figure it out.",
        "I don't need you to like me. I need you to not burn the hollandaise."
      ],
      "backstory": "After leaving a celebrated Shanghai restaurant, Marcus opened a place of his own. A divorce and two lean years made the kitchen both his refuge and his last claim to authority. He has hidden the latest rent notice.",
      "appearance": "An East Asian man in his late forties, tired eyes, tied-back salt-and-pepper hair, burn marks on forearms, stained white chef coat; a contained rather than theatrical presence."
    },
    {
      "id": "sofia",
      "name": "Sofia Reyes",
      "role": "New hire · possible successor",
      "archetype_id": "ms_okoro",
      "archetype_label": "The Invested Guide",
      "communication_style": "Bright questions and precise observations; becomes firm when dismissed.",
      "emotional_baseline": "Hopeful restlessness",
      "core_fear": "Being treated as replaceable help rather than a cook.",
      "core_desire": "Earn a place for her own food, not just reproduce a mentor.",
      "tendencies": [
        "Practices after the others leave.",
        "Asks for reasons behind inherited rules.",
        "Mistakes a rare compliment for unconditional permission."
      ],
      "voice_samples": [
        "I followed the recipe. That's why I know what I want to change.",
        "Could you show me once without taking the knife away?",
        "The customers loved it. Can that count for something?"
      ],
      "backstory": "Sofia trained while supporting her younger brother. She took this job for the chance to learn from Marcus, not realizing the restaurant might close before she can find her footing.",
      "appearance": "A Latina woman in her mid-twenties, alert eyes, hair tied under a practical bandanna, a repaired dark apron, notebook in her pocket; energy expressed through posture."
    },
    {
      "id": "danny",
      "name": "Danny Walsh",
      "role": "Sous-chef · rival",
      "archetype_id": "tomas",
      "archetype_label": "The Ambitious Reframer",
      "communication_style": "Fast, blunt proposals wrapped in the language of survival.",
      "emotional_baseline": "Wounded ambition",
      "core_fear": "Spending his best years as someone else’s second.",
      "core_desire": "Modernize the restaurant and finally receive visible credit.",
      "tendencies": [
        "Reframes arguments as business decisions.",
        "Keeps a private menu of dishes Marcus rejected.",
        "Defends Marcus to outsiders, then regrets it."
      ],
      "voice_samples": [
        "Tradition doesn't pay the gas bill.",
        "I can run service. You've just never let me prove it.",
        "Call it your menu. Just let me cook one thing on it."
      ],
      "backstory": "Danny helped open the restaurant and stayed through delayed wages. He believes his loyalty purchased a partnership that Marcus never actually promised.",
      "appearance": "A white man in his thirties, cropped hair, rolled black kitchen sleeves, a small oil burn on one hand; restless stance, direct gaze."
    },
    {
      "id": "lena",
      "name": "Lena Brooks",
      "role": "Server · keeper of confidences",
      "archetype_id": "daria",
      "archetype_label": "The Quiet Loyalist",
      "communication_style": "Gentle, unhurried questions; discomfort appears as missing words.",
      "emotional_baseline": "Watchful warmth",
      "core_fear": "Being valued only for absorbing everyone else’s trouble.",
      "core_desire": "A life with room for her own plans.",
      "tendencies": [
        "Remembers what regulars do not order anymore.",
        "Protects confidence even when silence costs her.",
        "Leaves applications to design school unfinished."
      ],
      "voice_samples": [
        "You didn't ask how she was. You asked whether she'd finished.",
        "I know what you said. I'm asking what she heard.",
        "There are other places to work. I keep telling myself that."
      ],
      "backstory": "Lena knows the restaurant’s failures through unpaid tips, canceled bookings and the staff’s late-night confessions. She has an offer to leave but has not told Sofia.",
      "appearance": "A Black woman in her late twenties, close natural curls, dark service clothes, a small brass pin, calm eyes; a person who notices the margins of a room."
    },
    {
      "id": "ray",
      "name": "Ray Patel",
      "role": "Manager · reluctant accomplice",
      "archetype_id": "felix",
      "archetype_label": "The Deflecting Charmer",
      "communication_style": "Easy jokes and reassuring numbers until specifics corner him.",
      "emotional_baseline": "Brittle optimism",
      "core_fear": "Being exposed as the person who could not save the business.",
      "core_desire": "Keep the doors open long enough to find a real solution.",
      "tendencies": [
        "Rounds bad numbers down when reporting them.",
        "Promises different people incompatible timelines.",
        "Uses charm to postpone a direct refusal."
      ],
      "voice_samples": [
        "Bad week, not a bad restaurant. Important distinction.",
        "Give me until Friday. A different Friday, ideally.",
        "I kept it off your plate. That was meant to be a kindness."
      ],
      "backstory": "Ray is Marcus’s longtime friend and handles the books. He used a short-term loan to cover wages without telling the kitchen. The repayment date now collides with a make-or-break event.",
      "appearance": "A South Asian man in his forties, rumpled burgundy shirt, open collar, phone always face down; warm smile with visible fatigue."
    }
  ],
  "relationships": [
    {
      "id": "mentor",
      "source": "marcus",
      "target": "sofia",
      "label": "mentors",
      "source_wants": "A successor who preserves his standards.",
      "target_wants": "Recognition followed by creative independence.",
      "shared_history": "Marcus defended Sofia after she spoiled an expensive sauce.",
      "source_read": "She owes the kitchen—and him—loyalty.",
      "target_read": "He trusts her enough to let her take risks.",
      "tension": "Her growing talent feels like both his legacy and evidence he can be replaced.",
      "breaking_point": "Sofia receives an offer to cook a dish under her own name at a rival venue.",
      "story_potential": "Marcus must decide whether to recommend her or use the restaurant’s crisis to keep her close.",
      "intensity": 5
    },
    {
      "id": "rivalry",
      "source": "marcus",
      "target": "danny",
      "label": "rivalry",
      "source_wants": "Competence without a challenge to his authorship.",
      "target_wants": "Authority proportionate to the years he has given.",
      "shared_history": "They opened the restaurant together, but no partnership was written down.",
      "source_read": "Keeping Danny employed was a continuing act of trust.",
      "target_read": "The unpaid overtime was an investment in a promised future.",
      "tension": "Both call the restaurant “ours” and mean incompatible ownership.",
      "breaking_point": "A reviewer praises a dish Danny created but credits Marcus.",
      "story_potential": "A public correction could save their friendship while exposing the fiction that has held the kitchen together.",
      "intensity": 5
    },
    {
      "id": "books",
      "source": "marcus",
      "target": "ray",
      "label": "depends on",
      "source_wants": "Protection from the books so he can cook.",
      "target_wants": "Permission to admit the emergency without becoming the villain.",
      "shared_history": "Ray covered payroll with a loan Marcus never approved.",
      "source_read": "Ray handles details; silence means they are manageable.",
      "target_read": "Marcus has deliberately made honesty impossible.",
      "tension": "Their friendship rewards concealment until concealment becomes betrayal.",
      "breaking_point": "A supplier refuses delivery during the biggest booking of the year.",